{
  "$schema": "https://json-schema.org/draft/2020-12/schema",
  "$id": "https://github.com/AlbertoMitroi/devos-intelligence-contract/schema/query/v1/di.schema.json",
  "title": "query di: `json` is the observation as canonical JSON text",
  "type": "array",
  "items": {
    "required": [
      "kind",
      "path",
      "line",
      "json"
    ],
    "properties": {
      "kind": {
        "type": "string"
      },
      "path": {
        "type": [
          "string",
          "null"
        ]
      },
      "line": {
        "type": [
          "integer",
          "null"
        ],
        "minimum": 1
      },
      "json": {
        "type": "string"
      }
    },
    "type": "object",
    "additionalProperties": true
  }
}
