[{"json":"{\"consumer\":\"ts:.:src/app/features/leases/lease-detail#LeaseDetail\",\"context\":\"ctx:98d047cbd0cc11c8c193fd1b2255885b\",\"evidence\":[\"ev:28a9cdbd7db8ffb1ececf9476647eca4\"],\"id\":\"obs:5891d4edc066dadfa9623dfb0c9bc3b1\",\"key\":null,\"kind\":\"di.consumes\",\"project\":\".\",\"service\":\"ts:.:src/app/features/leases/leases.service#LeasesService\",\"via\":\"inject\"}","kind":"di.consumes","line":24,"path":"src/app/features/leases/lease-detail.ts"},{"json":"{\"consumer\":\"ts:.:src/app/features/leases/lease-list#LeaseList\",\"context\":\"ctx:98d047cbd0cc11c8c193fd1b2255885b\",\"evidence\":[\"ev:e2218cab0cb512ebeeaa12838db364ba\"],\"id\":\"obs:fef0f18560650b2db59c720cc6b5a153\",\"key\":null,\"kind\":\"di.consumes\",\"project\":\".\",\"service\":\"ts:.:src/app/features/leases/leases.service#LeasesService\",\"via\":\"inject\"}","kind":"di.consumes","line":24,"path":"src/app/features/leases/lease-list.ts"},{"json":"{\"conditional\":false,\"context\":\"ctx:98d047cbd0cc11c8c193fd1b2255885b\",\"evidence\":[\"ev:8018de5c244b3ae1ef86b04808518c17\"],\"existing\":null,\"factory\":null,\"id\":\"obs:cb4c4e611d3d43ba95c41198433c34ed\",\"implementation\":\"ts:.:src/app/features/leases/leases.service#LeasesService\",\"key\":null,\"kind\":\"di.registers\",\"lifetime\":\"root\",\"multi\":false,\"project\":\".\",\"registrationPath\":\"root\",\"service\":\"ts:.:src/app/features/leases/leases.service#LeasesService\",\"value\":false}","kind":"di.registers","line":20,"path":"src/app/features/leases/leases.service.ts"}]
